[
  {
    "id": "es-rete-rc",
    "titolo": "Rete RC passa-basso: modulo, fase e pulsazione di taglio",
    "area": 2,
    "tipo": "tipo_esercizio",
    "gruppo": "A",
    "worker": "W6",
    "sapere": "Per RC serie con uscita sul condensatore, $H(\\omega)=\\frac{1}{1+j\\omega RC}$, $|H|=\\frac{1}{\\sqrt{1+(\\omega RC)^{2}}}$, fase $-\\arctan(\\omega RC)$ e $\\omega_{c}=\\frac{1}{RC}$.",
    "saper_fare": [
      "Impostare il partitore con $ZC=\\frac{1}{j\\omega C}$ all’uscita sul condensatore.",
      "Ricavare modulo, fase e pulsazione di taglio.",
      "Disegnare i limiti a bassa/alta frequenza e il punto $-3$ dB."
    ],
    "prerequisiti": [
      {
        "id": "sistemi-lineari-funzione-trasferimento",
        "forza": "hard",
        "motivo": "Prerequisito indicato dal contratto per comprendere e svolgere l’esercizio."
      }
    ],
    "tempo_studio_min": 35,
    "priorita": {
      "livello": "alta",
      "motivazione": "Esercizio della raccolta d’esame."
    },
    "fonti": [
      {
        "chiave": "FILE1",
        "rif": "file1 p. 14 (rif. p. 3.11)"
      }
    ],
    "risorse": [],
    "checklist_ripasso": [
      "Verifico che l’uscita sia sul condensatore.",
      "Controllo $|H(\\omega_{c})|=\\frac{1}{\\sqrt{2}}$ e fase $-\\frac{\\pi}{4}$."
    ]
  },
  {
    "id": "es-rete-cr",
    "titolo": "Rete CR passa-alto: modulo, fase e pulsazione di taglio",
    "area": 2,
    "tipo": "tipo_esercizio",
    "gruppo": "A",
    "worker": "W6",
    "sapere": "Per il circuito CR con uscita sul resistore, $H(\\omega)=\\frac{j\\omega RC}{1+j\\omega RC}$, $|H|=\\frac{\\omega RC}{\\sqrt{1+(\\omega RC)^{2}}}$, fase $\\frac{\\pi}{2}-\\arctan(\\omega RC)$ e $\\omega_{c}=\\frac{1}{RC}$.",
    "saper_fare": [
      "Applicare il partitore con uscita sul resistore.",
      "Ricavare modulo, fase e pulsazione di taglio.",
      "Disegnare la risposta crescente e i limiti di fase."
    ],
    "prerequisiti": [
      {
        "id": "sistemi-lineari-funzione-trasferimento",
        "forza": "hard",
        "motivo": "Prerequisito indicato dal contratto per comprendere e svolgere l’esercizio."
      }
    ],
    "tempo_studio_min": 35,
    "priorita": {
      "livello": "alta",
      "motivazione": "Esercizio della raccolta d’esame."
    },
    "fonti": [
      {
        "chiave": "FILE1",
        "rif": "file1 p. 13 (rif. p. 3.12)"
      }
    ],
    "risorse": [],
    "checklist_ripasso": [
      "Controllo che l’uscita sia sul resistore.",
      "Verifico il limite del modulo: zero in DC e uno ad alta frequenza."
    ]
  }
]
