[
  {
    "id": "es-spettri-impulsi-periodici",
    "titolo": "Successione periodica: coefficienti, armoniche e fase",
    "area": 1,
    "tipo": "tipo_esercizio",
    "gruppo": "A",
    "worker": "W6",
    "sapere": "La successione di rettangoli centrati ha righe a $n\\omega_{0}$, $c_{0}=\\frac{A\\tau}{T}$ e $c_{n}=(\\frac{A\\tau}{T})\\operatorname{sinc}(\\frac{n\\pi\\tau}{T})$. Una traslazione del rettangolo moltiplica $c_{n}$ per $e^{-j n\\omega_{0} t_{c}}$; la fase generale è $\\operatorname{arg}(c_{n})$.",
    "saper_fare": [
      "Calcolare $c_{0}$ e le armoniche $c_{n}$ da un integrale su un periodo.",
      "Disegnare righe in $n\\omega_{0}$ e il loro inviluppo sinc campionato densamente.",
      "Determinare la fase da $\\operatorname{arg}(c_{n})$, escludendo le armoniche nulle."
    ],
    "prerequisiti": [
      {
        "id": "serie-fourier",
        "forza": "hard",
        "motivo": "Prerequisito indicato dal contratto per comprendere e svolgere l’esercizio."
      }
    ],
    "tempo_studio_min": 35,
    "priorita": {
      "livello": "alta",
      "motivazione": "Esercizio della raccolta d’esame."
    },
    "fonti": [
      {
        "chiave": "FILE1",
        "rif": "file1 p. 1 (rif. p. 2.13)"
      }
    ],
    "risorse": [],
    "checklist_ripasso": [
      "Controllo che le righe siano distanziate di $\\omega_{0}$.",
      "Dichiaro se il rettangolo è centrato o traslato e uso $\\operatorname{arg}(c_{n})$."
    ]
  },
  {
    "id": "es-spettri-impulso-rettangolare",
    "titolo": "Rettangolo isolato: sinc continua, zeri e fase",
    "area": 1,
    "tipo": "tipo_esercizio",
    "gruppo": "A",
    "worker": "W6",
    "sapere": "L’impulso rettangolare isolato di ampiezza A e durata $\\tau$ ha trasformata continua $A\\tau \\operatorname{sinc}(\\frac{\\omega\\tau}{2})e^{-j\\omega t_{c}}$. Gli zeri sono $\\omega=\\frac{2\\pi k}{\\tau}$; la fase è $\\operatorname{arg} X(\\omega)$, non è definita ai nodi.",
    "saper_fare": [
      "Integrare il rettangolo centrato e ottenere $X(\\omega)$.",
      "Valutare il limite $X(0)=A\\tau$ e individuare gli zeri.",
      "Disegnare modulo e fase, includendo la traslazione temporale."
    ],
    "prerequisiti": [
      {
        "id": "trasformata-fourier",
        "forza": "hard",
        "motivo": "Prerequisito indicato dal contratto per comprendere e svolgere l’esercizio."
      }
    ],
    "tempo_studio_min": 35,
    "priorita": {
      "livello": "alta",
      "motivazione": "Esercizio della raccolta d’esame."
    },
    "fonti": [
      {
        "chiave": "FILE1",
        "rif": "file1 p. 2 (rif. p. 2.14)"
      }
    ],
    "risorse": [],
    "checklist_ripasso": [
      "Controllo X(0) con l’area del rettangolo.",
      "Distinguo modulo |X| da trasformata con segno e fase."
    ]
  },
  {
    "id": "es-antitrasformata-rettangolare",
    "titolo": "Spettro rettangolare: antitrasformata e sinc temporale",
    "area": 1,
    "tipo": "tipo_esercizio",
    "gruppo": "A",
    "worker": "W6",
    "sapere": "Uno spettro bilatero costante $X_{0}$ per $|\\omega|\\le \\omega_{m}$ ha antitrasformata $x(t)=\\frac{X_{0} \\sin(\\omega_{m}t)}{\\pi t}$, con limite $x(0)=\\frac{X_{0}\\omega_{m}}{\\pi}$ e zeri a $t=\\frac{k\\pi}{\\omega_{m}}$.",
    "saper_fare": [
      "Eseguire l’antitrasformata con il fattore $\\frac{1}{2\\pi}$.",
      "Valutare il limite al centro e localizzare i primi zeri.",
      "Disegnare il lobo principale e i lobi laterali alternati."
    ],
    "prerequisiti": [
      {
        "id": "trasformata-fourier",
        "forza": "hard",
        "motivo": "Prerequisito indicato dal contratto per comprendere e svolgere l’esercizio."
      }
    ],
    "tempo_studio_min": 35,
    "priorita": {
      "livello": "alta",
      "motivazione": "Esercizio della raccolta d’esame."
    },
    "fonti": [
      {
        "chiave": "FILE1",
        "rif": "file1 p. 3 (rif. p. 2.19)"
      }
    ],
    "risorse": [],
    "checklist_ripasso": [
      "Controllo il fattore $\\frac{1}{2\\pi}$ della trasformata inversa.",
      "Verifico valore al centro e zeri prima di disegnare."
    ]
  }
]
